[
  {
    "schema_version": "0.1.0",
    "registry_id": "example-intensifier",
    "codebook_id": "example-intensifier-codebook",
    "codebook_version": "0.1.0",
    "title": "Toy English intensifier codebook",
    "summary": "Toy codebook-as-program package for testing the lingputation registry infrastructure. It is not empirically validated.",
    "status": "draft",
    "authors": [
      {
        "name": "Brett Reynolds"
      }
    ],
    "codebook_path": "data/codebooks/example-intensifier/codebook.json",
    "validation_records": [
      {
        "id": "example-intensifier-validation",
        "path": "data/validation-records/example-intensifier-validation.json",
        "status": "template"
      }
    ],
    "projectibility_profile": {
      "supported_inferences": [
        "After validation, within-register frequency comparison of degree-intensifier candidates under a fixed extraction procedure."
      ],
      "unsupported_inferences": [
        "Individual speaker cognition.",
        "All-register English claims.",
        "Diachronic trends without a separate measurement-drift check."
      ],
      "scope_conditions": [
        "Same register and sampling frame.",
        "Same codebook version.",
        "Reported abstention rates."
      ],
      "failure_zones": [
        "Focus particles with degree-like paraphrases.",
        "Quoted language and metalinguistic mention.",
        "Idiomatic or lexicalized combinations."
      ]
    },
    "tags": [
      "toy",
      "intensifiers",
      "projectibility-profile",
      "codebook-as-program"
    ],
    "links": [],
    "license": "CC BY 4.0",
    "created": "2026-07-04",
    "updated": "2026-07-04"
  }
]
